prod_id,title,main_cat,sub_cat,image_url,price,desc,homepage_rank,is_original,is_active,format_id,photographer_id,year_taken
vint32,Turn of the Century Bascule ,chicago vintage,vintage chicago skyline,http://www.horschgallery.com/Thumbnail%20Images/turn-of-the-century-bascule_vint32.jpg,49,"The city of Chicago sure has changed over the years.    Check out more Chicago   vintage photos and vintage   Chicago sports pictures from earlier decades such as the 1920's,   1930's, 1940's and 1950's.  Note:  This     photograph was not taken by Bob Horsch.",0,TRUE,TRUE,1,1,2001
vint33,Downtown near Dearborn - Historic Chicago Picture ,chicago vintage,vintage chicago skyline,http://www.horschgallery.com/Thumbnail%20Images/downtown-near-dearborn-historic-chicago-picture_vint33.jpg,49,"The city of Chicago sure has changed over the years.    Check out more Chicago   vintage photos and vintage   Chicago sports pictures from earlier decades such as the 1920's,   1930's, 1940's and 1950's.  Note:  This     photograph was not taken by Bob Horsch.",0,TRUE,TRUE,1,1,2001
vint35,Tribune Building during turn of the Century ,chicago vintage,vintage chicago skyline,http://www.horschgallery.com/Thumbnail%20Images/tribune-building-during-turn-of-the-century_vint35.jpg,49,"The city of Chicago sure has changed over the years.    Check out more Chicago   vintage photos and vintage   Chicago sports pictures from earlier decades such as the 1920's,   1930's, 1940's and 1950's.  Note:  This     photograph was not taken by Bob Horsch.",0,TRUE,TRUE,1,1,2001
vint36,Vintage Chicago Tribune Tower ,chicago vintage,historic vintage chicago landmarks,http://www.horschgallery.com/Thumbnail%20Images/vintage-chicago-tribune-tower_vint36.jpg,49,"The city of Chicago sure has changed over the years.    Check out more Chicago   vintage photos and vintage   Chicago sports pictures from earlier decades such as the 1920's,   1930's, 1940's and 1950's.  Note:  This     photograph was not taken by Bob Horsch.",0,TRUE,TRUE,1,1,2001
vint37,State & Madison after Chicago Fire - Historical Chicago ,chicago vintage,chicago street cars,http://www.horschgallery.com/Thumbnail%20Images/state-madison-after-chicago-fire-historical-chicago_vint37.jpg,49,"The city of Chicago sure has changed over the years.    Check out more Chicago   vintage photos and vintage   Chicago sports pictures from earlier decades such as the 1920's,   1930's, 1940's and 1950's.  Note:  This     photograph was not taken by Bob Horsch.",0,TRUE,TRUE,1,1,2001
vint38,Fulton Street Market - Vintage Chicago ,chicago vintage,historic vintage chicago landmarks,http://www.horschgallery.com/Thumbnail%20Images/fulton-street-market-vintage-chicago_vint38.jpg,49,"The city of Chicago sure has changed over the years.    Check out more Chicago   vintage photos and vintage   Chicago sports pictures from earlier decades such as the 1920's,   1930's, 1940's and 1950's.  Note:  This     photograph was not taken by Bob Horsch.",0,TRUE,TRUE,1,1,2001
vint41,Old Chicago Picture - Trolley Cars ,chicago vintage,chicago street cars,http://www.horschgallery.com/Thumbnail%20Images/old-chicago-picture-trolley-cars_vint41.jpg,49,"The city of Chicago sure has changed over the years.    Check out more old  Chicago photos and vintage    Chicago sports prints from earlier decades such as the 1920's,   1930's, 1940's and 1950's.  Note:  This      photograph was not taken by Bob Horsch.",0,TRUE,TRUE,1,1,2001
vint43,Vintage Chicago -  Art Institute ,chicago vintage,historic vintage chicago landmarks,http://www.horschgallery.com/Thumbnail%20Images/vintage-chicago-art-institute_vint43.jpg,49,"The city of Chicago sure has changed over the years.    Check out more old  Chicago photos and vintage    Chicago sports prints from earlier decades such as the 1920's,   1930's, 1940's and 1950's.  Note:  This      photograph was not taken by Bob Horsch.",0,TRUE,TRUE,1,1,2001
vint40,Lasalle & Quincy - Vintage Chicago ,chicago vintage,historic vintage chicago landmarks,http://www.horschgallery.com/Thumbnail%20Images/lasalle-quincy-vintage-chicago_vint40.jpg,49,"The city of Chicago sure has changed over the years.    Check out more old  Chicago pictures and vintage    Chicago sports prints from earlier decades such as the 1920's,   1930's, 1940's and 1950's.  Note:  This      photograph was not taken by Bob Horsch.",0,TRUE,TRUE,1,1,2001
vint42,Chicago Trolley Cars - Vintage Chicago ,chicago vintage,chicago street cars,http://www.horschgallery.com/Thumbnail%20Images/chicago-trolley-cars-vintage-chicago_vint42.jpg,49,"The city of Chicago sure has changed over the years.    Check out more old   Chicago pictures and vintage     Chicago sports prints from earlier decades such as the 1920's,   1930's, 1940's and 1950's.  Note:  This       photograph was not taken by Bob Horsch.",0,TRUE,TRUE,1,1,2001
4082,Staircase at the Chicago Cultural Center ,chicago landmarks,other famous chicago landmarks,http://www.horschgallery.com/Thumbnail%20Images/staircase-at-the-chicago-cultural-center_4082.jpg,49,,0,TRUE,TRUE,1,1,2001
4060,Buckingham Fountain - Blue Sky ,chicago landmarks,buckingham fountain,http://www.horschgallery.com/Thumbnail%20Images/buckingham-fountain-at-night_4060.jpg,49,,0,TRUE,TRUE,1,1,2001
891,State Street in the 1980s ,chicago landmarks,state street,http://www.horschgallery.com/Thumbnail%20Images/state-street-in-the-1980's_891.jpg,49,,0,TRUE,TRUE,1,1,2001
bw123,Waves Crashing ,chicago black & white,black & white chicago - vertical,http://www.horschgallery.com/Thumbnail%20Images/waves-crashing_bw123.jpg,49,,0,TRUE,TRUE,1,1,2001
bw122,Rough Waters on the Pier ,chicago black & white,black & white chicago - horizontal,http://www.horschgallery.com/Thumbnail%20Images/rough-waters-on-the-pier_bw122.jpg,49,,0,TRUE,TRUE,1,1,2001
bw120,North Avenue Pier Fall Day ,chicago black & white,black & white chicago - horizontal,http://www.horschgallery.com/Thumbnail%20Images/north-avenue-pier-fall-day_bw120.jpg,49,,0,TRUE,TRUE,1,1,2001
563,The S Curve of Lake Shore Drive ,chicago aerials,chicago aerial views,http://www.horschgallery.com/Thumbnail%20Images/the-s-curve-of-lake-shore-drive_563.jpg,49,"Lake Shore Drive stayed essentially the same until 1975, when Wacker Drive was extended east to meet LSD at the S-curve.   Then, around 1982, construction began on a re-configuration of the S-Curve. From Monroe Street to Wacker Drive, LSD was rerouted east along new fill, greatly reducing the sharpness of the curve. This section opened in 1987.",0,TRUE,TRUE,1,1,2001
vint45,The S Curve of Lake Shore Drive - Black & White ,chicago vintage,vintage chicago skyline,http://www.horschgallery.com/Thumbnail%20Images/the-s-curve-of-lake-shore-drive-black-white_vint45.jpg,49,"Lake Shore Drive stayed essentially the same until 1975, when Wacker Drive was extended east to meet LSD at the S-curve.   Then, around 1982, construction began on a re-configuration of the S-Curve. From Monroe Street to Wacker Drive, LSD was rerouted east along new fill, greatly reducing the sharpness of the curve. This section opened in 1987.",0,TRUE,TRUE,1,1,2001
bw46,The James R. Thompson Center ,chicago black & white,black & white chicago - vertical,http://www.horschgallery.com/Thumbnail%20Images/the-james-r.-thompson-center_bw46.jpg,49,,0,TRUE,TRUE,1,1,2001
3047,2009 Winter Classic Photo Framed- National Anthem ,chicago blackhawks,2009 winter classic,http://www.horschgallery.com/Thumbnail%20Images/2009-winter-classic-photo-national-anthem_3047.jpg,49,"This photo was taken inside Wrigley Field in the upper deck above home plate as the players for both teams lined up for the national anthems.  The 2009 NHL Winter Classic was a specially-staged National Hockey League regular-season game played outdoors on January 1, 2009 at Wrigley Field. The game was between the Chicago Blackhawks and the defending Stanley Cup champion Detroit Red Wings. The photograph has the option to come with a black plate with the following:  WINTER CLASSIC JANUARY 1, 2009",0,TRUE,TRUE,1,1,2001
1849,View of Soldier Field and Chicago Skyline ,chicago bears,soldier field aerials,http://www.horschgallery.com/Thumbnail%20Images/view-of-soldier-field-and-chicago-skyline_1849.jpg,49,"This aerial photo taken during the mid 1980's shows off the great city of Chicago.  All in one image we see Soldier Field, Grant Park, the Field Museum, the Adler Planetarium, Michigan Lake, and the beautiful city skyline.",0,TRUE,TRUE,1,1,2001
4083,Light Show at The Bean - Millennium Park ,chicago landmarks,millennium park,http://www.horschgallery.com/Thumbnail%20Images/light-show-at-the-bean-millennium-park_4083.jpg,49,"Thanks to a $100,000 tourism grant  local artists Sean Gallero  and Petra Bachmaier of Humboldt Park's Luftwerk  were hired to imbue  the half-billion-dollar urban oasis with site-specific fun. Using Anish Kapoor's cityscape-reflecting,  110-ton Cloud Gate sculpture 'The Bean' as a centerpiece, the  married couple has devised a high-tech light show - dubbed 'Luminous Field'  - on the surrounding plaza.",0,TRUE,TRUE,1,1,2001
bw125,The Bean Light Show - Black & White ,chicago landmarks,millennium park,http://www.horschgallery.com/Thumbnail%20Images/the-bean-light-show-black-white_bw125.jpg,49,"Using Anish Kapoor's cityscape-reflecting,  110-ton Cloud Gate sculpture 'The Bean' as a centerpiece, the  married couple has devised a high-tech light show - dubbed 'Luminous Field'  - on the surrounding plaza.  This photograph was taken in black and white to give it a timeless feel.",0,TRUE,TRUE,1,1,2001
bw124,Chicago Lakefront Bike Path on Lake Shore Drive - Chicago Cycling ,chicago black & white,black & white chicago - horizontal,http://www.horschgallery.com/Thumbnail%20Images/chicago-lakefront-bike-path-on-lake-shore-drive-chicago-cycling_bw124.jpg,49,"This Chicago black and white photograph captures part of the xx mile long lakefront bike path adjacent to Lake Shore Drive.  Cyclists, runners, walkers, roller blades and many more are found on the path during all seasons.",0,TRUE,TRUE,1,1,2001
bw126,Chicago Fall Season - Leafless Trees ,chicago black & white,black & white chicago - horizontal,http://www.horschgallery.com/Thumbnail%20Images/chicago-fall-season-leafless-trees_bw126.jpg,49,,0,TRUE,TRUE,1,1,2001
vint46,Historic Chicago Building on Market Street ,chicago vintage,historic vintage chicago landmarks,http://www.horschgallery.com/Thumbnail%20Images/historic-chicago-building-on-market-street_vint46.jpg,49,,0,TRUE,TRUE,1,1,2001
1683,Cubs First Night Game 8-8-88 at Wrigley Field ,chicago cubs,wrigley field,http://www.horschgallery.com/Thumbnail%20Images/cubs-first-night-game-8-88-at-wrigley-field_1683.jpg,49,"This is a classic photo taken before the start of the Chicago Cubs first night game on 8/8/88.    The photo was taken from the rooftop of  the Cubby Bear Bar & Restaurant.  The photo features the Cubs Marquee with the words, 'WELCOME TO OPENING NIGHT'.",0,TRUE,TRUE,1,1,2001
2808,Wrigley Field Marquee - Home of Chicago Cubs ,chicago cubs,wrigley field,http://www.horschgallery.com/admin/uploads/Products/Product181/2808-wrigley-field.jpg,49,"In this photograph, the picture focuses on the Chicago Cubs Marquee found at the front gates of the Wrigley Confines.  The words 'Home of the Chicago Cubs' are written on the Marquee.  Opened in 1914, Wrigley Field is the second oldest baseball stadium behind Fenway Park.",0,TRUE,TRUE,1,1,2001
a10,Vintage Comiskey Park - Historical Chicago White Sox Black & White Picture ,chicago vintage,vintage chicago sports,http://www.horschgallery.com/Thumbnail%20Images/vintage-comiskey-park-historical-chicago-white-sox-black-white-picture_a10.jpg,49,"Historical Comiskey Park was the ballpark in which the Chicago White Sox played from 1910 to 1990. It was built by Charles Comiskey and was the site of four World Series (one of which was played by the Chicago Cubs due to lack of seating at Wrigley Field) and more than 6,000 major league games.  ***Note:  This historic Chicago White Sox photograph is not an original photograph taken by Bob Horsch",0,TRUE,TRUE,1,1,2001
vint16,Historic Chicago - Traffic Jam on Randolph Street in 1909 ,chicago vintage,chicago street cars,http://www.horschgallery.com/Thumbnail%20Images/historic-chicago-traffic-jam-on-randolph-street-in-1909_vint16.jpg,49,"Now this is what I call a traffic jam.  I-94 or I-55 has nothing on this.  The intersection is jam packed with trolley cars, wagons, trucks loaded with lumber, pedestrians and even horses!.  I think it's safe to say that many people were late for dinner that night.  Note:  This photograph was not taken by Bob Horsch.",0,TRUE,TRUE,1,1,2001
vint1,Historical Chicago Print - Street Cars on State Street ,chicago vintage,chicago street cars,http://www.horschgallery.com/Thumbnail%20Images/historical-chicago-print-street-cars-on-state-street_vint1.jpg,49,This vintage Chicago photographs captures the scene on State street 'That Great Street' back when trolley cars and Ford model T's owned the roads.  It's fascinating to see all the pedestrians dressed in proper attire.  Note:  This  photograph was not taken by Bob Horsch.,0,TRUE,TRUE,1,1,2001
vint44,Marshall Fields Christmas - Old State Street Circa 1980s ,chicago vintage,vintage chicago skyline,http://www.horschgallery.com/Thumbnail%20Images/marshall-field's-christmas-old-state-street-circa-1980's_vint44.jpg,49,"This photograph features the historic Marshall Field's Company located on State Street, 'That Great Street' during the Christmas season in the early 1980's.",0,TRUE,TRUE,1,1,2001
bw68,Chicago River- East View- Black & White ,chicago black & white,black & white chicago - vertical,http://www.horschgallery.com/Thumbnail%20Images/chicago-east-black-white_bw68.jpg,49,"River North is a neighborhood in the Near North Side community area of Chicago, Illinois. It is bound by Michigan Avenue to the east, Chicago Avenue to the north, and the Chicago River to the south and west.   This neighborhood, home of The River North Gallery District, has the largest concentration of art galleries in the United States outside of Manhattan. Along with hundreds of art galleries, the area holds many bars, dance clubs, popular restaurants, and entertainment venues.",0,TRUE,TRUE,1,1,2001
4084,Lincoln Park View of Chicago Skyline ,chicago cityscape,chicago cityscape,http://www.horschgallery.com/Thumbnail%20Images/lincoln-park-view-of-chicago-skyline_4084.jpg,49,This unobstructed view of Lincoln Park looking South is one of my  top 5 spectacular views of Chicago.  You get to view the park and our beautiful Skyline along with the Chicago Lakefront.,0,TRUE,TRUE,1,1,2001
1669,Illini Football - Memorial Stadium Aerial ,big 10 college football,big ten college stadiums,http://www.horschgallery.com/admin/uploads/Products/Product88/Illinois-illini-footbal-stadium.jpg,49,"This aerial photo features an outdoor view of Memorial Stadium, home to the University of Illinois at Urbana-Champaign Fighting Illini Big Ten college football team.  This was taken approximately 15 years ago.",0,TRUE,TRUE,1,1,2001
1671,Michigan State Football - Spartan Stadium ,big 10 college football,big ten college stadiums,http://www.horschgallery.com/admin/uploads/Products/Product92/1671_THAM.JPG,49,"This aerial photo features Spartan Stadium, home to the Michigan State University Spartans Big Ten college football team  This photograph was taken around 1990.",0,TRUE,TRUE,1,1,2001
1664,Wisconsin Football Stadium - Camp Randall Stadium - Badgers ,big 10 college football,big ten college stadiums,http://www.horschgallery.com/admin/uploads/Products/Product87/1664_THAM.JPG,49,"This aerial photo features the college campus of the University of Wisconsin focusing on Camp Randall Stadium, home to the Wisconsin Badgers Big Ten college football team.  This photograph was taken around 1990.",0,TRUE,TRUE,1,1,2001
bw21,John Hancock Building ,chicago black & white,black & white chicago - horizontal,http://www.horschgallery.com/Thumbnail%20Images/the-el-train-cta-brown-line_bw21.jpg,49,This is a B&W photo taken from North Avenue. The reflections from the street lights on Lake Shore Drive casts a nice glare onto Lake Michigan. It also features the John Hancock building standing tall over the Drake Hotel.,0,TRUE,TRUE,1,1,2001
4096,Oak Street Beach & John Hancock Building ,chicago aerials,chicago aerial views,http://www.horschgallery.com/Thumbnail%20Images/oak-street-beach-john-hancock-building_4096.jpg,49,This early morning aerial is a great view of the Gold Coast Area that also includes Oak street Beach  along with the majestic view of the John Hancock Building.,0,TRUE,TRUE,1,1,2001
4097,Diversey Harbor - Chicago Aerial ,chicago aerials,chicago aerial views,http://www.horschgallery.com/Thumbnail%20Images/diversey-harbor-aerial-view_4097.jpg,49,"This aerial of Diversey Harbor, taken in the early morning, is an updated photo because of the ever changing Harbor.  I especially love to photograph this area of the beautiful shoreline.",0,TRUE,TRUE,1,1,2001
4098,Belmont Harbor - Aerial View ,chicago aerials,chicago aerial views,http://www.horschgallery.com/Thumbnail%20Images/belmont-harbor-aerial-view_4098.jpg,49,"It's not often that I am able to capture both Diversey & Belmont Harbor in the same image, but this was an exceptionally clear morning around 8:00 a.m.",0,TRUE,TRUE,1,1,2001
4099,31st Street Harbor & Chicago Skyline ,chicago aerials,chicago aerial views,http://www.horschgallery.com/Thumbnail%20Images/31st-street-harbor-chicago-skyline_4099.jpg,49,"This is the new South Side Harbor at 31 st Street. Unfortunately there are not many boats in the Harbor yet, but I do enjoy the shape of the Harbor along with the North view of the skyline.",0,TRUE,TRUE,1,1,2001
4100,Aerial View of Belmont Harbor ,chicago aerials,chicago aerial views,http://www.horschgallery.com/Thumbnail%20Images/aerial-view-of-belmont-harbor-_4100.jpg,49,This is an updated view of  Belmont Harbor with the early morning light.  It includes the Harbor and the buildings along Sheridan Drive.,0,TRUE,TRUE,1,1,2001
4101,Montrose Harbor - Aerial View ,chicago aerials,chicago aerial views,http://www.horschgallery.com/Thumbnail%20Images/montrose-harbor-aerial-view_4101.jpg,49,This view is an updated photo of the boats in Montrose Harbor.,0,TRUE,TRUE,1,1,2001
4095,North Avenue Beach & the Lakefront ,chicago aerials,chicago aerial views,http://www.horschgallery.com/Thumbnail%20Images/north-avenue-beach-the-lakefront_4095.jpg,49,"This aerial is also one of my favorite views of the Lakefront which includes the 'Hook ' of North Avenue and the popular beach attraction, Castaways.  I try to update this view about every 10 years.",0,TRUE,TRUE,1,1,2001
bw129,Wrigley Field Ballpark - Black & White  ,chicago cubs,black & white wrigley field,http://www.horschgallery.com/Thumbnail%20Images/wrigley-field-ballpark-black-white-_bw129.jpg,49,"This is a great 2012 black and white photograph of Wrigley Field which gives the stadium a vintage, classic look.  This photo would make a great collector's piece for any die hard Cubs fan.  Opened in 1914, Wrigley Field is the second oldest baseball stadium behind Fenway Park.",0,TRUE,TRUE,1,1,2001
vint39,Randolph Street - Vintage Chicago ,chicago vintage,chicago street cars,http://www.horschgallery.com/Thumbnail%20Images/randolph-street-vintage-chicago_vint39.jpg,49,"The city of Chicago sure has changed over the years.    The vintage Chicago photograph was taken of Randolph street.  Check out more old   Chicago pictures and vintage     Chicago sports prints from earlier decades such as the 1920's,   1930's, 1940's and 1950's.  Note:  This       photograph was not taken by Bob Horsch.",0,TRUE,TRUE,1,1,2001
vint9,Lake Street Traffic - Vintage Chicago Print ,chicago vintage,chicago street cars,http://www.horschgallery.com/Thumbnail%20Images/lake-street-traffic-vintage-chicago-print_vint9.jpg,49,,0,TRUE,TRUE,1,1,2001
vint23,Street Cars on Dearborn Street ,chicago vintage,chicago street cars,http://www.horschgallery.com/Thumbnail%20Images/street-cars-on-dearborn-street_vint23.jpg,49,,0,TRUE,TRUE,1,1,2001
a4,Willie Mays & Ernie Banks - Vintage Wrigley Field ,chicago vintage,vintage chicago sports,http://www.horschgallery.com/Thumbnail%20Images/willie-mays-ernie-banks-vintage-wrigley-field_a4.jpg,49,"This is a classic shot of two great baseball Hall of Famers, Ernie Banks and WIllie Mays.  ***Note:  This photograph is not an original photograph taken by Bob Horsch",0,TRUE,TRUE,1,1,2001
a7,Vintage Chicago Bears - George Halas & Vince Lombardi ,chicago vintage,vintage chicago sports,http://www.horschgallery.com/Thumbnail%20Images/vintage-chicago-bears-george-halas-vince-lombardi_a7.jpg,49,This is a rare vintage Chicago Bears photo taken of George Halas and Vince Lombardi standing on the side lines together.  Both were two of the most influential coaches in the game of football.  ***Note:  This photograph is not an original photograph taken by Bob Horsch,0,TRUE,TRUE,1,1,2001
a9,Vintage Chicago Blackhawks - Historic Chicago Stadium ,chicago vintage,vintage chicago sports,http://www.horschgallery.com/Thumbnail%20Images/vintage-chicago-blackhawks-historic-chicago-stadium_a9.jpg,49,"This vintage Chicago Blackhawks photograph features the Chicago Stadium.  It was an indoor sports arena and a theater in Chicago, Illinois. The Stadium hosted the Chicago Blackhawks of the NHL from 1929-1994 and the Chicago Bulls of the NBA from 1967-1994.  ***Note:  This photograph is not an original photograph taken by Bob Horsch",0,TRUE,TRUE,1,1,2001
a11,Vintage Chicago Stadium Print - Historical Blackhawks Black & White ,chicago blackhawks,old chicago stadium,http://www.horschgallery.com/Thumbnail%20Images/vintage-chicago-stadium-print-historical-blackhawks-black-white_a11.jpg,49,"The historical Chicago Stadium was an indoor sports arena and a theater in Chicago, Illinois. The Stadium hosted the Chicago Blackhawks of the NHL from 1929-1994 and the Chicago Bulls of the NBA from 1967-1994.  ***Note:  This historic Chicago Blackhawks photograph is not an original photograph taken by Bob Horsch",0,TRUE,TRUE,1,1,2001
vint30,Old Soldier Field Stadium - Early Construction in Black & White ,chicago bears,soldier field,http://www.horschgallery.com/Thumbnail%20Images/old-soldier-field-stadium-early-construction-in-black-white_vint30.jpg,49,"This old photograph of Soldier Field was taken during the early stages of construction.  It is fascinating that the playing field is nothing more than mounds of dirt at the time.  You can also see men dressed in suits and vests as they put in their hard earned day of work plowing through land on horse and cart.  In the background, the scaffolding is still in place as the finishing touches are put on the large famous pillars.  Note:  This     photograph was not taken by Bob Horsch.",0,TRUE,TRUE,1,1,2001
2859,Streetville Area on the Chicago River ,chicago cityscape,chicago cityscape,http://www.horschgallery.com/Thumbnail%20Images/streetville-area-on-the-chicago-river_2859.jpg,49,"Streeterville is a neighborhood in the Near North Side community area of Chicago, Illinois, United States, north of the Chicago River in",0,TRUE,TRUE,1,1,2001
2884,Billy Goat Tavern Under Michigan Avenue ,chicago landmarks,other famous chicago landmarks,http://www.horschgallery.com/Thumbnail%20Images/billy-goat-tavern-under-michigan-avenue_2884.jpg,49,"The Billy Goat Tavern is a chain of taverns located in Chicago, Illinois, founded in by Billy Sianis, a Greek immigrant. It achieved fame primarily through newspaper columns by Mike Royko, a supposed curse on the Chicago Cubs, and the Olympia Cafe sketch on Saturday Night Live.",0,TRUE,TRUE,1,1,2001
2898b,Skyscrapers in the Loop Near Chicago River ,chicago cityscape,chicago cityscape,http://www.horschgallery.com/Thumbnail%20Images/skyscrapers-in-the-loop-near-chicago-river_2898b.jpg,49,"The Loop or Chicago Loop is one of 77 officially designated community areas located in the City of Chicago, Illinois.  It is the historic commercial center of downtown Chicago. It is also the seat of government for Chicago and Cook County, as well as the historic theater and shopping district (including State Street).",0,TRUE,TRUE,1,1,2001
2901,Rookery Building Entrance ,chicago landmarks,other famous chicago landmarks,http://www.horschgallery.com/Thumbnail%20Images/rookery-building-entrance_2901.jpg,49,,0,TRUE,TRUE,1,1,2001
2945,Merchandise Mart - Holiday Lights ,chicago cityscape,chicago cityscape,http://www.horschgallery.com/Thumbnail%20Images/merchandise-mart-holiday-lights_2945.jpg,49,"When opened in 1930, the Merchandise Mart, located in the Near North Side of Chicago was the largest building in the world with 4,000,000 square feet of floor space.  Previously owned by the Marshall Field family, the Mart centralized Chicago's wholesale goods business by consolidating vendors and trade under a single roof.    Massive in its construction, and serving as a monument to early 20th century merchandising and architecture, the art deco landmark anchors the daytime skyline at the junction of the Chicago River branches. With upper levels bathed in colored floodlight, the structure stands out against darker downtown buildings in night views. The building continues to be a leading retailing and wholesale destination, hosting 20,000 visitors and tenants per day.    Did you know that the Merchandise Mart is so large that it had its own ZIP code?  It is 60654.  Finally in 2008, the zip code began to be shared with part of the surrounding area.",0,TRUE,TRUE,1,1,2001
